body,label,sector
"['“The Nifty Bank index (PE) multiple of 16.6 remains considerably lower than Nifty 50’s current PE ratio of 22.6, signifying further upside potential in case of a sectoral re-rating brought about by improving quarterly results,"" Raghvendra Nath, Managing Director at Ladderup Wealth Management says in an interview to Moneycontrol.', 'He believes, smaller cap banks are offering a more attractive risk-reward ratio than sector heavyweights.', 'Hence, investors could benefit immensely from the potential valuation upside offered by these smaller cap banking stocks, especially as their performance and balance sheets improve with every financial quarter, says Raghvendra with more than 29 years of corporate experience with a deep knowledge of the financial markets.', 'While the Reserve Bank of India (RBI) hiked the repo rate by 250 basis points in FY23, banks continue to report healthy double-digit lending growth rates, highlighting the robust demand growth being witnessed across different sectors and industries within the Indian economy.', 'Moreover, both public and private sector banks remain well capitalized and are sporting healthy balance sheets, with asset quality expected to improve further as non-performing assets (NPAs) are projected to come down to 4 percent by the end of the current fiscal year. On the flipside though, a potential economic slowdown and persistently high inflation levels could dampen consumer spending, especially across key product segments like credit card loans, car and home loans.', 'The negative impact on net interest margins (NIMs) could offset future credit growth, underscoring the need for banks to tap into new sources of value to minimize margin pressures.', 'Also read:\xa0', 'The Nifty Bank index has recorded a 13.3 percent appreciation over the past one year and is trading at a price-earning (PE) multiple of 16.6, as per current price levels. While this is significantly higher than the average PE ratio commanded by the banking sector in the recent past, it remains considerably lower than Nifty 50’s current PE ratio of 22.6, signifying further upside potential in case of a sectoral re-rating brought about by improving quarterly results.', 'In fact, with the Indian banking sector expected to grow at a CAGR of 10.4 percent between 2023 to 2027, the future growth prospects for the Indian banking sector seem brighter than ever.', 'As banks focus on widening their reach and bring new customers into their fold through a flurry of digital initiatives, investors ought to utilize any future price dips to average their holdings or take the SIP route to invest for the longer term. Investing in leading banking names is highly recommended for those with a low to moderate risk appetite, while those with a higher risk profile can opt for a number of beaten-down banking stocks that are still available at cheaper valuations.', 'Also read:\xa0', 'Offering a more attractive risk-reward ratio than sector heavyweights, investors could benefit immensely from the potential valuation upside offered by these smaller cap banking stocks, especially as their performance and balance sheets improve with every financial quarter.', 'As India surmounts an impressive challenge to China’s current dominance as the world’s largest manufacturing hub, buoyant market sentiments have boosted stock valuations across both engineering and manufacturing sectors. So much so that the S&P BSE Capital Goods Index has returned a eye-watering 41.5 percent over the last one year, with certain stocks more than doubling on the back of strong revenue growth and ever-increasing profit margins.', 'However, this run up could halt in the near future as foreign investment flows moderate further due to slackening growth in major economies across the globe. Moreover, with Indian manufactured exports accounting for less than a tenth of China’s global manufacturing trade, Indian firms will continue to rely heavily on domestic consumption to boost revenue and profit growth in the near term.', 'That said, there are certain brighter spots within the Indian manufacturing and engineering space that investors could capitalize upon. Take for example the electronics manufacturing segment that has witnessed exports swelling to ~$23billion in FY23 and which is showing no signs of abating, especially as global technology companies like Apple make a concerted effort to shift as much as 25 percent of their production to India.', 'Also read:\xa0', 'Similarly, engineering firms directly benefitting from India’s massive infrastructure push and rising electric vehicle (EV) technology adoption continue to offer promising valuation growth potential, despite commanding premium valuations in comparison with the industry average.', 'After reporting impressive profits during the COVID-19 pandemic, Indian pharmaceutical players are seeing demand growth from US and European markets flattening out, pushing them to tap other markets to prop up export and earnings growth. Still, domestic demand is expected to expand at high single-digit growth rates over the next decade and is being backed by an increasing governmental push towards achieving Universal Health Coverage (UHC) goals.', 'As Indian pharma players double down on their efforts to innovate highly-effective yet cheaper biosimilars, companies with a strong product pipeline and stellar track record should be preferred by investors looking to participate in the Indian pharma story.', 'Within the utilities space though, investors need to adopt a stock-specific approach since many segments have underperformed massively over the past two years. Power generation and distribution companies as well as those focused on renewable energy can offer good upside potential in the event of no major downside trigger for the overall Indian economy.', 'Investors looking to invest in the utilities sector should moderate their expectations and instead focus on picking up fundamentally sound businesses at important price support zones.', 'While the RBI left key interest rates unchanged at its recent monetary meeting, it surprised many analysts by raising the inflation forecast for FY24 by 30 basis points. Moreover, the move to increase the cash reserve ratio (CRR) by additional 10 percent signals its intention to absorb excess liquidity in the banking system, being more of a short-term liquidity management measure than having any larger implications.', 'While it hasn’t made any comments on future interest rate cuts for the rest of 2023, the RBI’s hawkish stance has effectively pushed any interest rate revisions to the later part of the current fiscal, if not later.', 'Nevertheless, the RBI’s latest move reaffirms its unflinching commitment towards reigning in inflation and is intended to promote sustainable economic activity expansion in what is the world’s fastest growing major economy. Investors need to closely watch out for global cues and central bank actions, with any possible positive driver further motivating the RBI to adopt a more dovish monetary policy approach.', 'Despite commanding a valuation premium when compared to international indices, the Indian equity market has been trending higher in 2023 and is projected to outperform global peers in FY24. Certain global and macroeconomic risks could still weigh on Indian investor sentiments and dampen further market appreciation, chief amongst which is the looming chance of a global recession. That said, with high levels of inflation and global growth concerns clouding the near-term market outlook, domestic investors will have to adopt a sector-specific and measured investing approach to eke out gains in the foreseeable future.', 'This could potentially unlock a multitude of investment opportunities, especially in fundamentally solid companies that have remained focused on organic expansion, rather than over-leveraging their balance sheets to fuel rapid expansion. In such an uncertain macro environment, investors should tread carefully and diversify their risk, choosing to invest in leading or promising companies that are best positioned to benefit from India’s bright prospects in the above outlined sectors.']",,
"[""In an interview with Moneycontrol, Devang Mehta, Director of Equity Advisory at Spark Private Wealth, stated that the Indian market's response to the US credit rating downgrade should not be a long-term concern. Mehta believes that India's inflation trajectory and monetary policy management have been better than those of its peers."", 'He feels important factors such as earnings, crude prices and fund flows will be the key to the market in the medium term.', 'On the great theme to bet on, Devang with more than 23 years of experience in the areas of wealth management, investment advisory, equity research, equity sales & portfolio management says one theme which has sort of made a huge comeback after a long hibernation is capital expenditure.', 'He believes\xa0the sectors that benefit from this theme include infrastructure, capital goods, cement, building materials, automation, and power ancillaries.', 'Globally & even locally the speed of this rally has been too swift & hence the market can find an excuse to correct on the back of this news. However, the impact on the Indian market should be short-lived as India has had a relatively better inflation trajectory and monetary policy management than its peers.', 'Other important factors such as earnings, crude prices and fund flows will be the key to the market in the medium term.', 'After such a fast & furious rally in the last couple of months, a minor correction & consolidation is in fact good for the health of the markets. Though we should be enthused & happy about hitting new highs, it’s just a number and records are made to be broken.', 'It is important to note that, equity returns are lumpy and non-linear. Nothing happens for two years & in weeks, light years happen in terms of returns.', ""One needs to analyse, the factors which led markets to a new high: do these still hold good today, if the answer is yes, we are in for better times. India's growth shines amidst the global economic challenges and hence someone looking for the longer term should ideally take advantage of correction rather than getting worried."", 'As Peter Lynch says, “Far more money has been lost by investors preparing for corrections, or trying to anticipate corrections than has been lost in corrections themselves....”', 'The Federal Reserve’s latest hike came as no surprise to investors who had already factored in the possibility of such a move. Ultimately, the Federal Reserve is attempting to orchestrate a soft landing following a period of high inflation and rate hikes.', 'The US economy has been resilient despite high inflation and tightening monetary policy. The unemployment rate is near record lows in half of US states, and consumer confidence is at a two-year high. Despite the “higher for longer” rhetoric, a sustainable drop in inflation along with a slowdown in US growth should likely lead the Fed to cut rates in the first half of 2024.', 'Ideally, a well-diversified portfolio should be the order of the day. Recently, the\xa0theme which has sort of made a huge comeback after a long hibernation is capital expenditure (capex). In a pre-election year, government fiscal expenditure on infra & other allied activity stays in momentum. Order flows to industrial companies/capital goods sector have also increased, with year-on-year growth of over 15 percent from the pre-pandemic lows of 5 percent.', ""There's reason for optimism as capacity utilization is currently at 75%, surpassing the historical average. For instance, railway capex has increased from Rs 80,000 crore to Rs 2,50,000 crore in just three years. This significant rise in allocations will benefit both public and private companies. Additionally, new private projects are being announced due to increasing government capital expenditure, which has reached an all-time high."", 'Top sectors which benefit as a part of this theme are infrastructure, capital goods, cement, building materials, automation, and power ancillaries. Corporate lenders also form a proxy to play this theme as they will be beneficiaries of credit growth to fund the expansion of these companies.', 'Indian HNI & retail investors have shown extraordinary maturity by staying invested in equities despite higher volatility, interim market corrections, long periods of drift and competition from FDs even during a rising rate environment. The rewards are now bound to come.', 'In an expansionary phase of the economy, generally, the mid & small cap companies tend to do well. Also with capacity utilizations rising, balance sheets de levered and robust capex, credit growth & consumption, this space looks attractive.', 'Also, short-term drawdowns in this space in times of heightened volatility have to be something which one has to have an appetite for. The fundamental matrix & merit to buy or hold that business in the portfolio should be the deciding factor. The portfolio should be constructed and nurtured with companies having robust revenues and earnings visibility along with strong corporate governance.', 'Weak discretionary spending has been witnessed across many verticals, especially in financial services. Overall, we expect low single-digit growth for most companies. Most of the businesses in the large-cap space have had a decent price & valuation correction.', 'However, it would be prudent here to be market cap agnostic and look at themes within the IT space, where rather than orders for essential spending focus is on developmental & growth spending, which will start once the slowdown or recession fears die down. Also, within the sector, one has to pick & choose businesses with niche advantages and core competencies which are second to none.', 'India stands out amongst other EMs (emerging markets) due to its lower external vulnerabilities, strong corporate balance sheets and an estimated 2 to 3-year conservative earnings CAGR of at least 13 to 14 percent for the Nifty index. Various parameters including current account and fiscal situation, forex reserves, strong GST collections and inflation levels continue to encourage investors.', 'The prevailing socio-economic and political stability, extremely strong digital footprint, visible changes in terms of infrastructure and urbanisation coupled with a restrained inclination towards populist measures along with the government’s thrust on continual reforms and comprehensive policies like the introduction of the PLI scheme, will continue to attract FII flows in India.']",positive,finance
"['An Indian woman studying in Canada was criticised on Twitter recently for stating that it was her dream to leave India and her favourite part of living in Canada was getting to see sunrise and sunset.', 'In the video shared on Twitter, the woman can be seen answering questions from a male presenter where she reveals she was studying biotech and later intended to become a businesswoman.', '""I lived in Canada for a year and moved back. That one year was the most depressing year. The summers are good but winters are a nightmare. Trust me India is far better than Canada if you are well educated,"" one user wrote.', '""Sad , she went to Canaddda to see sunset and sunshine , she could have just gone to her building terrace,"" another user wrote.', '""Not generalising, but the fact of the matter is Canada is mostly importing India\'s trash. I\'ve personally experienced people who couldn\'t read and write in english properly are scoring 8-9 bands in IELTS. People who say Canada has more opportunities than India are fools,"" a third user wrote.', '""It\'s called study-tourism. When you can\'t get into any good college in US or Europe, you choose low-hanging Canada, because that would be an ego-pumping thing. One of my cousins went to study microbiology in Canada, he\'s working at a gas station now doing accounts. Lol,"" another user wrote.']",negative,others
"['""We believe the second quarter (Q2) ended September 2023 will not be significantly different from the first quarter (Q1) ended June 2023. We expect Q2FY24 to be flattish to marginally positive for technology stocks,"" said Rohit Agarwal, Executive Vice President & Equity Fund Manager at Kotak Mahindra Life Insurance Company, in an interview with Moneycontrol.', 'According to him, the IT deal pipeline remains robust, with companies still securing deals. However, implementation is experiencing delays due to current circumstances.', ""With more than 11 years of experience in capital markets, Agarwal is optimistic about the capital goods sector. He believes that the Government's increased focus on investment has gained momentum, and currently, public capital expenditure is in a very healthy state."", 'We believe the second quarter (Q2) ending September 2023 will not be significantly different from the first quarter (Q1) ended June 2023. Some margin levers will be offset by wage hikes and growth will be challenging as the deal ramp-up cycle continue to remain elevated.', 'However, it will be instrumental in setting the tone for the second half (October 2023 to March 2024) where there are still question marks around recovery.', 'We expect Q2FY24 to be flattish to marginally positive for technology stocks. The deal pipeline is still very healthy, companies are still winning deals, it’s just that the implementation of the deals is getting delayed due to the circumstances.', 'Selectively, yes. Few of them have shown initial green shoots and are beneficiaries of a low base. We believe that higher revenue share from digital service offerings, improving metrics like low client concentration, better utilisation, and improving cash flows work in their favour.', 'Within midcaps, some of the companies have the capability to become large caps of tomorrow if they continue to deliver in the way that they have been in the last few years.', 'We are not expecting a big spending cycle globally just yet. Even though interest rates are close to peak now and a pivot for the rates is pretty close, interest rates are not expected to get cut in an accelerated manner.', 'We are expecting interest rate cuts to be very gradual, a shallow rate cut cycle. We are currently not in the camp of rate cuts in the US for this calendar year. We expect the US Fed to gradually start cutting rates from next calendar year.', 'The ongoing corporate earnings season has been a mixed bag as of now. Most of the IT bellwethers have reported numbers below market expectations. At the same time, companies in the banking and financial services space have declared numbers that have exceeded market expectations.', 'Although it’s too early to take a call on the corporate earnings for the quarter just started, earnings season is unlikely to see any meaningful cuts per se in market expectations for the full year.', 'We believe that the capital goods sector still looks very good. The focus from the Government on the investment side has picked up momentum. Public capex is very healthy at the moment. Projects related to metro rail, airports, and roads have picked up across the country.', 'Even private-sector capex is starting to pick up in sectors like steel, cement and power. We are looking at a big capex cycle in India in the next few years.', 'The worst of rural slowdown seems to be over. Given the rains in the month of July, barring some geographies, it now seems to be under control. This should lead to better rural demand in the second half of the year.', 'In the next 2-3 quarters there are quite a few states and general elections. This should lead to a good uptick in demand from rural India. Sowing has been good and demand from Rural India has already stopped decelerating giving confidence that the worst of the slowdown is now behind.', 'Commodity price pressure has eased up quite a bit. The commodities whose prices had gone up post covid and then due to geo-political reasons, they have already either corrected quite a bit or are correcting. Hence, the pressure on margins for the companies which use these commodities has started to ease. Some of it will be passed on so as to get better volume growth, rest will actually go back to enhancing margins.', 'The Federal Reserve just hiked the policy rates. Going forward, it suggested that any more hikes will be data-dependent. The US CPI print is already around 3 percent. We believe that there is a possibility of a maximum of one more rate hike in this calendar year and that will likely be the peak for the interest rates from the Feds. Thereafter, we expect an extended pause or a gradual softening of interest rates.']",negative,finance
"['The market regulator has reduced the timeline for listing of securities after the closure of public issue to three days, from the current six working days.', 'With T as the issue-closing date, the securities will now have to be listed on T+3 day versus the current T+6 day. This will be an option for public issues opening after September 1, 2023, and will be a mandatory requirement for issues opening after December 1, 2023.', 'The Securities and Exchange Board of India (', ') circular dated August 9 specified the revised timelines for listing of specified securities and various activities involved in the public issue.', 'Accordingly, application submission by investors, bid modification, validation of bid details with depositories, reconciliation of UPI mandate transactions, UPI mandate acceptance and issue closure will be done on T day.', 'Third-party checks on UPI applications, third-party checks on non-UPI applications, submission of final certificates, finalisation of rejections and completion of basis and approval of basis by the stock exchange should be done by T+1 day.', 'Issuance of fund transfer instructions in separate files for debit and unblock will need to be initiated and completed on T+1 day.', 'Corporate action execution of credit of shares, filing of listing application with stock exchanges and issuance of the trading notice, and publishing of allotment advertisement on the relevant website should also be done on T+2 day.', 'Publishing the allotment advertisement in newspapers can be completed by T+3 day but not later than T+4 day.', 'On the T+3 day, trading in the stock will start.', 'The circular added that the T+3 timeline for listing shall be disclosed in the offer documents of public issues.', 'Under general instructions, the circular added that compensation to investors for the delay in unblocking ASBA application monies (if any) shall be computed from T+3 day itself.', 'The instructions also added that for Direct Bank ASBA and Syndicate ASBA applications, prior to blocking of ASBA application monies in the bank account of the applicant, the self-certified syndicate banks (SCSBs) shall ensure that the PAN mentioned in the application matches with the PAN linked to the bank account of the applicant maintained with the bank; and that the PAN linked to the bank account of the applicant shall be part of the bidding data on the Stock Exchange platform.']",negative,finance
