body,label,sector
"['""Noisy"" data can lead to bad policy decisions — which is why economists are advising caution amid the ongoing wild upswing in retail prices. Even though the Reserve Bank of India (RBI) has said it stands ready to take further action, surely the Monetary Policy Committee (MPC) will not increase interest rates on August 10 to counter a jump in inflation driven primarily by vegetable prices?', 'To be fair, the ', "", with some economists seeing the possibility of last month's headline retail inflation, data for which will be released on August 14, having crossed even 7 percent. It is often in times such as these that the RBI has, in the past, taken comfort in core inflation."", ""Core CPI inflation — or inflation excluding food and fuel— has dropped dramatically in the last few months. After being rather sticky at 6 percent-plus, core inflation fell to 5.1 percent in May and stayed there in June. This would have particularly pleased the MPC, whose last two repo rate hikes in December 2022 and February 2023 — totalling 60 basis points — were intended to break the persistence of core inflation. So it would not be a surprise to see the MPC's August 10 statement treat the vegetable price spike as a temporary phenomenon rooted in supply-side issues and instead bask in the withdrawal of core inflation, which is seen as a proxy for underlying price pressures."", '""The RBI is likely to take comfort from the fact that persistence in core inflation has come down a notch and is unlikely to be affected by the increase in perishables food prices,"" Rahul Bajoria, managing director and head of emerging markets Asia (ex-China) economics at Barclays, said in a note on August 1.', 'The problem, however, lies in the reliability of core inflation as a measure of underlying price changes.', 'The issues with the CPI are well known and were further highlighted earlier this year when the ', 'due to a tweak in the methodology.', 'The entire basket of goods and services is also severely outdated due to the government junking the results of the 2017-18 edition of the Consumer Expenditure Survey, which is the basis for making wholesale revisions to the CPI series.', 'If the CPI suffers from issues, core CPI will too, as it is merely a subset of the former. The four groups it is made up of account for 47.3 percent of the CPI. And one of these—housing, which makes up 10 percent of the entire CPI basket and 21 percent of core CPI—suffers from huge measurement issues.', 'CPI housing inflation in June was only 4.56 percent. In fact, it has been under 5 percent for more than four years but anyone who has tried to rent a home in the last year or so will think this is a cruel joke.', 'According to property portal ', ', the all-India average rental rate was 15.3 percent higher in the first three months of 2023 compared to January-March 2022. Meanwhile, housing inflation as per the CPI averaged 4.8 percent in January-March 2023.', 'How is the CPI underestimating housing—and, therefore, core—inflation? The problem lies with the methodology. As much as 1.3 percent of the CPI basket — more than the combined weight of onions and tomatoes — is made up of employer-provided dwellings, mostly by the public sector. And rent for government-provided houses depends on who lives in it and their house rent allowance (HRA).', '""If we measure an increase or decrease in rent when there is a change in the tenant of a privately rented house, then such changes reflect actual movements in market rent. However, the movements in rent of government dwelling due to change in the resident, has no relation to actual change in rental prices,"" an RBI staff paper said in November 2018.', 'Core CPI inflation can change depending on what items are included in it. Economists prefer to refine their definition of core inflation and exclude certain fuels and metals that are included in the ""miscellaneous"" group of the CPI basket. Some also remove the most volatile items within the core and look at a \'trimmed mean\' measure.', 'While these measures may have their merits, they do not solve the methodology issues with housing.', 'This, however, will not stop the MPC from seeking refuge in core inflation on August 10. After all, the rate-setting panel must work with what is available. To be fair to the committee, at least one member has bemoaned the outdated nature of the CPI and its impact on monetary policy decision making.', '""The index needs to be updated as quickly as possible. The MPC has to spend far too much time and effort on prices of various food items that are beyond its influence. I had raised this issue when I joined the MPC but the status quo prevails,"" Ashima Goyal, one of the three external members of the MPC, ', '.', 'All ', '. Until then, the RBI and the MPC must tune out the noise and focus on what it can—be it headline inflation or core.']",negative,finance
"['Rarely has a movie timed the zeitgeist as perfectly as\xa0', ',\xa0the story of a man, and all humanity, becoming “death, the destroyer of worlds.” Real life\xa0seems hell-bent on imitating art these days.', 'The blame for the global spike in nuclear anxiety belongs mainly, but not exclusively, to Russian\xa0President Vladimir Putin. Surely the\xa0situation brought about by his invasion of Ukraine and his recurring rattles of the atomic saber must also change how the US thinks about its own atomic strategy. But how exactly?', 'Putin has, over the past 500 days or so, destroyed each of the\xa0', '\xa0that developed during the Cold War to prevent an atomic arms race and Armageddon. First, he’s broken the nuclear taboo, by casually threatening the use of such diabolical weapons. Second, he’s undermined the consensus against nuclear proliferation, by demonstrating that foregoing nukes —\xa0', '\xa0in the 1990s —\xa0leaves a nation vulnerable to people like him. Third, he’s chipped at the barrier between bad and good uses of fission, by turning the Ukrainian nuclear power plant at Zaporizhzhia, occupied by his troops since last March, into a\xa0', '.', 'Russian television, propaganda, intelligentsia and society have taken their leader’s cue and normalised atomic intimidation, sometimes with apocalyptic hysterics. Sergei Karaganov, once an esteemed Russian defense-policy pundit,\xa0', '\xa0a particularly disturbing debate by asserting that the way to restore\xa0the West’s diminished fear of\xa0Russia’s power was for the Kremlin to\xa0drop tactical atomic bombs —\xa0not on Ukraine, but on eastern European countries that belong to NATO. The US-led West, Karaganov is sure, won’t dare to retaliate.', 'No matter\xa0that Karaganov\xa0', '\xa0for the Kremlin, or that other Russian voices tried to temper his\xa0', '\xa0logic. What matters is that in the space of a year the tone of\xa0nuclear geopolitics has deteriorated in ways not even the pessimists,\xa0', ', considered possible. This year, Putin also suspended New START, the last remaining arms control treaty between the US and Russia. And he\xa0', '\xa0tactical warheads in his neighboring quasi-vassal state of Belarus.', 'The growing importance of such tactical warheads, designed to win battles rather than incinerate nations,\xa0is what worries me most.\xa0Russia\xa0', '\xa0more than 1,900 tactical nukes, roughly ten times more than the US. (The limitations of the\xa0', '\xa0applied only to longer-range “strategic” nukes.) And those are the weapons Putin has been menacing with. He appears to think that such “limited” nuclear warfare can compensate for his army’s revealed shortcomings in conventional warfare. And he seems to assume that tactical warheads, because they’re smaller, would blur the line at which the US would retaliate with its own nuclear strikes.', 'This assumption is unfathomably dangerous. It’s true that the US and its allies, in order to try to\xa0control escalation spirals, have decided to punish Putin for first use of a tactical nuke “only” with a debilitating\xa0', '\xa0strike against Russian forces, probably those in Ukraine. But Putin or his successors, faced with catastrophic defeat and demise, would then have even more incentive to use additional tactical nukes. How would the West respond to those subsequent strikes, especially if they irradiate, or even hit, NATO territory?', 'The reality —\xa0and the factor that Karaganov willfully\xa0ignored —\xa0is that\xa0game theory cannot reliably\xa0forecast or quantify the risks of escalation once even the first warhead detonates. One\xa0', '\xa0modeled how a single Russian tactical strike, in the space of less than an hour, escalates into a full nuclear exchange that leaves 44 million dead and 57 million injured, not counting the radiation fatalities that come later. As US President Joe Biden\xa0', ', “I don’t think there’s any such thing as an ability to easily use a tactical nuclear weapon and not end up with Armageddon.”', 'At first glance, the logic of deterrence might suggest that\xa0the US should try to close this gap in tactical nukes vis-a-vis Russia as part of the ongoing “modernisation” of its atomic arsenal. Only $6 billion of the $756 billion that the Congressional Budget Office\xa0', '\xa0America will spend over the next decade on upgrading its nuclear forces\xa0is slated to go to tactical weapons, and only $3 billion to their modernisation. That’s after the Biden administration canceled a program to build tactical nukes launched on\xa0cruise missiles from ships. Given what Putin is up to, isn’t that unwise?', 'Not really. That, at least, is the\xa0near-consensus among many in the nuclear know. It’s a mistake to think that enemy powers could trade tactical strikes indefinitely, says Daryl Kimball, head of the Arms Control Association in Washington, DC. The damage would be so devastating so quickly that the conflict would either end or escalate to strategic nukes and Armageddon. So there’s no military rationale for\xa0having more than a few dozen tactical weapons.', 'The distinction between strategic and tactical nukes isn’t helpful, adds Jeffrey Lewis, a nonproliferation expert at the Middlebury Institute of International Studies at Monterey. The categories were created when the Soviets and Americans started negotiating about arms control during the Cold War, and wanted to include or exclude specific weapons they had. The logic of deterrence instead remains the same no matter the weapon: You need to persuade your adversary that\xa0', '\xa0resort to nuclear warfare will\xa0never succeed and will\xa0be answered with unacceptable destruction.', 'This suggests that the US already has the appropriate strategy for situations such as Putin’s war of aggression and nuclear bluster. It is, first, to maintain\xa0', 'military prowess so overwhelming that Putin could never gain anything from dropping a tactical nuke —\xa0the US would obliterate his forces with non-nuclear firepower. Second, it is to remind Putin that any apocalyptic turn, including\xa0nuclear launches at the West, would be answered in kind. The Cold War logic of “mutual assured destruction” still holds.', 'What complicates the longer-term picture is that\xa0a new arms race is also underway. China, a relatively small nuclear power with\xa0', ', plans to rapidly increase its stockpile to 1,000 this decade, with an ultimate goal of reaching parity with the US and Russia. That doesn’t mean China is a destabilising factor yet. Its president, Xi Jinping, has done\xa0more than anybody else so far to restrain Putin, by telling his nominal “friend”\xa0', '\xa0not to use a nuke, lest he lose Beijing’s support.', 'But China’s ambitions make\xa0arms control, never easy, fiendishly difficult. Even in the previous situation of two nuclear superpowers and seven middling or minor powers, the\xa0', '\xa0of disarmament and nonproliferation negotiations has stretched human cognition to its limits. China joining the US and Russia as an atomic superpower will turn that constellation into a “', '” —\xa0the kind that’s been driving scientists crazy ever since Isaac Newton tried and failed to go from modeling the earth and moon to considering those two and the sun as well.', 'For starters, should the US view Russia and China as separate threats, or potentially as one combined adversary? In that case, America would need to scale up its\xa0arsenal dramatically. That would be economically ruinous. It would also make the Chinese even more paranoid about US intentions, prompting them to accelerate their production.', 'Then there’s the prospect of proliferation. As North Korea adds to its nuclear stockpile, South Koreans become more likely to build their own nukes. If Iran crosses the atomic threshold and makes its own warheads, Saudi Arabia, Turkey and others in the region will eventually follow.', 'The surprising conclusion for the US, nonetheless, is that America already has the right strategy and should stick to it. That, too, is leadership —\xa0not to let wannabe tsars and tin-pot dictators provoke a superpower\xa0into runaway arms races. With the so-called\xa0', '\xa0watching, it behooves Washington to demonstrate that it —\xa0not Beijing or Moscow —\xa0is the responsible actor in world affairs.', 'For purposes of deterring Russia, China and all other adversaries, the US doesn’t actually need all the nukes it already has, Jon Wolfsthal, the nuclear specialist on the National Security Council during the administration of Barack Obama, told me. So “modernisation” is mainly about updating existing systems, from the warheads to the triad of delivery mechanisms on land, at sea and in the air. And that’s about right.', 'Beyond that, the US must signal that it’ll always stay open to negotiations, with Russia, China or any combination of countries. In time, and under different leaders in Moscow and other capitals, these talks could progress to encompass a global nuclear freeze, and eventually even the\xa0', '\xa0of nuclear weapons.', 'Until then, the US is right to deter, with conventional military superiority and the nuclear arsenal it has. Admittedly, even that thought doesn’t provide much comfort. The dirty secret of deterrence is that it works until it fails, and when it fails, it fails spectacularly.', 'Hence the anxiety ever present since\xa01945, when Robert Oppenheimer tested the first atomic bomb. While building it, the scientists worried that the blast might set off a chain reaction that would destroy the whole world, Oppenheimer tells Albert Einstein at the end of the new movie in cinemas now. “What of it?”, asks Einstein. “I believe we did,” replies Oppenheimer. And then the atoms start splitting.']",negative,others
"['The Reserve Bank of India (RBI) will hold its key interest rate at 6.50% through end-March 2024, according to a Reuters poll of economists, who pushed back their expectations for the first rate cut to the second quarter of 2024 from the first quarter in a June survey.', ""Inflation in Asia's third-largest economy snapped a four-month downward trend, climbing to 4.81% last month on higher food prices. Few are forecasting a plunge in coming months, offering little reason for the RBI to change policy now."", ""Indeed, inflation is expected to average above 5% this fiscal year, which ends on March 31, 2024, above the RBI's 4% medium-term target."", 'The July 13-31 Reuters poll of 75 economists showed the central bank was expected to keep its repo rate at 6.50% at its Aug. 10 policy meeting.', 'A majority said rates will stay there through the first quarter of 2024, followed by 50 basis points worth of cuts by the end of June, around the same time when markets expect the U.S. Federal Reserve to start cutting its rates.', 'In a June survey, economists predicted the RBI to cut the repo rate by 25 basis points by end-March 2024 and another 25 basis points in the April-June quarter.', '""They are not going to be very decisive in cutting rates and that is why we believe this pause ... may remain for a longer period unless there are clear signs of a slight weakness in growth or core inflation coming down,"" said Suman Chowdhuri, chief economist at Acuite Ratings and Research.', 'Among those who offered forecasts until March 2024, a slim majority, 32 of 62, expected rates to hold at 6.50%, while 20 saw a cut to 6.25%, and 10 said 6.00% or lower.', 'While a smaller number of forecasters provided rate views well into next year, median forecasts showed no further cuts beyond 6.00%.']",negative,finance
"['Real estate developer Puravankara posted a loss of Rs 17 crore in the first quarter of FY23 with a revenue of Rs 323 crore, up by 50 percent annually, the company said in a regulatory filing on August 11.', '""While the revenue is higher compared to last year, lower EBITDA and loss are on account of increased marketing expenses for 119 percent sales growth that cannot be capitalised. Additionally, the increased general and administrative (G&A) expenses to support the increased business activity will be recovered in coming quarters with increased delivery,"" sources in ', ' told ', '.', 'The company recorded sales of Rs 1,126 crore, up by 119 percent annually, for developing 1.36 million square feet (msf) in the quarter ended June 30.\xa0Collections from the buyers stood at Rs 696 crore in the April-June quarter.', '""The results for Q1 FY24 show a strong start to the new fiscal year. Presales have more than doubled to Rs 1,126 crore. With a robust pipeline of 15 msf of new launches this year, we are confident of continuing to drive our pre-sales growth momentum,"" Ashish ', ', Managing Director, Puravankara Limited.', 'Average price realisation in Q1 FY24 increased by 11 percent to Rs 8,227 per sq ft up from Rs 7,436 per sq ft last year.', 'Operating cash inflows stood at Rs 866 crore, a jump of over 30 percent annually while the\xa0EBITDA slipped by 46 percent annually to Rs 75 crore.', 'Net debt in the first quarter of FY23 stood at Rs 2,119 crore and the net debt to equity ratio touched at 1.07 for Q1. Net debt has reduced by Rs 89 crore compared to the previous quarter.', 'Balance collections from sold units (completed and ongoing) in all launched projects remained at Rs 3,052 crore while the total estimated surplus from all completed and ongoing projects is Rs 6,730 crore.', 'The ', ' said the total value of unsold inventory, including new launches in Q1FY24, touched Rs 5,528 crore.', 'Currently, the company is set to launch new projects spanning more than 15 msf across Bengaluru, Chennai, Kochi and Coimbatore this year and is eyeing a topline of Rs 18,000 crore from these launches in the next three years.']",negative,finance
